{
  "apiVersion": "hosting.lowerduckpond.net/v1alpha1",
  "kind": "AuditEntry",
  "sequence": 0,
  "previousEntryDigest": null,
  "timestamp": "2026-08-29T12:00:02Z",
  "operatorPrincipal": "operator@example.test",
  "operation": "create",
  "tenantId": "0191e2c4-8f7a-7c3b-8d1e-5f62047a2100",
  "correlationId": "0198d17f-6f4a-7000-8000-000000000001",
  "resultDigest": {
    "format": "lowerduckpond-result-v1",
    "algorithm": "sha256",
    "value": "1111111111111111111111111111111111111111111111111111111111111111"
  },
  "resultStatus": "succeeded"
}
